[
    {
        "name": "Mercury",
        "satellites": 0,
        "radius_km": 2440.0,
        "semi_major_axis_au": 0.387,
        "eccentricity": 0.206,
        "inclination_deg": 7.005,
        "argument_of_periapsis_deg": 29.124,
        "longitude_of_ascending_node_deg": 48.331,
        "mean_anomaly_deg": 174.796,
        "density_g_cm3": 5.427,
        "type": "planet"
    },
    {
        "name": "Venus",
        "satellites": 0,
        "radius_km": 6052.0,
        "semi_major_axis_au": 0.723,
        "eccentricity": 0.007,
        "inclination_deg": 3.395,
        "argument_of_periapsis_deg": 54.884,
        "longitude_of_ascending_node_deg": 76.68,
        "mean_anomaly_deg": 50.115,
        "density_g_cm3": 5.243,
        "type": "planet"
    },
    {
        "name": "Earth",
        "satellites": 1,
        "radius_km": 6371.0,
        "semi_major_axis_au": 1.0,
        "eccentricity": 0.017,
        "inclination_deg": 0.0,
        "argument_of_periapsis_deg": 114.208,
        "longitude_of_ascending_node_deg": 348.739,
        "mean_anomaly_deg": 357.517,
        "density_g_cm3": 5.514,
        "type": "planet"
    }
]